USB: option: replace ZTE K5006-Z entry with vendor class rule

Fix the ZTE K5006-Z entry so that it actually matches anything

  commit f1b5c997 USB: option: add ZTE K5006-Z

added a device specific entry assuming that the device would use
class/subclass/proto == ff/ff/ff like other ZTE devices. It
turns out that ZTE has started using vendor specific subclass
and protocol codes:

T:  Bus=01 Lev=01 Prnt=01 Port=03 Cnt=01 Dev#=  4 Spd=480  MxCh= 0
D:  Ver= 2.00 Cls=00(>ifc ) Sub=00 Prot=00 MxPS=64 #Cfgs=  1
P:  Vendor=19d2 ProdID=1018 Rev= 0.00
S:  Manufacturer=ZTE,Incorporated
S:  Product=ZTE LTE Technologies MSM
S:  SerialNumber=MF821Vxxxxxxx
C:* #Ifs= 5 Cfg#= 1 Atr=c0 MxPwr=500mA
I:* If#= 0 Alt= 0 #EPs= 2 Cls=ff(vend.) Sub=86 Prot=10 Driver=(none)
E:  Ad=81(I) Atr=02(Bulk) MxPS= 512 Ivl=0ms
E:  Ad=01(O) Atr=02(Bulk) MxPS= 512 Ivl=4ms
I:* If#= 1 Alt= 0 #EPs= 2 Cls=ff(vend.) Sub=02 Prot=05 Driver=(none)
E:  Ad=82(I) Atr=02(Bulk) MxPS= 512 Ivl=0ms
E:  Ad=02(O) Atr=02(Bulk) MxPS= 512 Ivl=4ms
I:* If#= 2 Alt= 0 #EPs= 3 Cls=ff(vend.) Sub=02 Prot=01 Driver=(none)
E:  Ad=83(I) Atr=03(Int.) MxPS=  64 Ivl=2ms
E:  Ad=84(I) Atr=02(Bulk) MxPS= 512 Ivl=0ms
E:  Ad=03(O) Atr=02(Bulk) MxPS= 512 Ivl=4ms
I:* If#= 3 Alt= 0 #EPs= 3 Cls=ff(vend.) Sub=06 Prot=00 Driver=qmi_wwan
E:  Ad=85(I) Atr=03(Int.) MxPS=  64 Ivl=2ms
E:  Ad=86(I) Atr=02(Bulk) MxPS= 512 Ivl=0ms
E:  Ad=04(O) Atr=02(Bulk) MxPS= 512 Ivl=4ms
I:* If#= 4 Alt= 0 #EPs= 2 Cls=08(stor.) Sub=06 Prot=50 Driver=usb-storage
E:  Ad=05(O) Atr=02(Bulk) MxPS= 512 Ivl=0ms
E:  Ad=87(I) Atr=02(Bulk) MxPS= 512 Ivl=0ms

We do not have any information on how ZTE intend to use these
codes, but let us assume for now that the 3 sets matching
serial functions in the K5006-Z always will identify a serial
function in a ZTE device.

Cc: Thomas Schäfer <tschaefer@t-online.de>
Cc: stable <stable@vger.kernel.org>
Signed-off-by: Bjørn Mork <bjorn@mork.no>
Signed-off-by: Greg Kroah-Hartman <gregkh@linuxfoundation.org>

