Bluetooth: btusb: Add support for Foxconn QCA 0xe0d0

Add an ID of Qualcomm Bluetooth SoC WCN6855.

T:  Bus=05 Lev=01 Prnt=01 Port=03 Cnt=02 Dev#=  4 Spd=12   MxCh= 0
D:  Ver= 1.10 Cls=e0(wlcon) Sub=01 Prot=01 MxPS=64 #Cfgs=  1
P:  Vendor=0489 ProdID=e0d0 Rev= 0.01
C:* #Ifs= 2 Cfg#= 1 Atr=e0 MxPwr=100mA
I:* If#= 0 Alt= 0 #EPs= 3 Cls=e0(wlcon) Sub=01 Prot=01 Driver=btusb
E:  Ad=81(I) Atr=03(Int.) MxPS=  16 Ivl=1ms
E:  Ad=82(I) Atr=02(Bulk) MxPS=  64 Ivl=0ms
E:  Ad=02(O) Atr=02(Bulk) MxPS=  64 Ivl=0ms
I:  If#= 1 Alt= 0 #EPs= 2 Cls=e0(wlcon) Sub=01 Prot=01 Driver=btusb
E:  Ad=83(I) Atr=01(Isoc) MxPS=   0 Ivl=1ms
E:  Ad=03(O) Atr=01(Isoc) MxPS=   0 Ivl=1ms
I:  If#= 1 Alt= 1 #EPs= 2 Cls=e0(wlcon) Sub=01 Prot=01 Driver=btusb
E:  Ad=83(I) Atr=01(Isoc) MxPS=   9 Ivl=1ms
E:  Ad=03(O) Atr=01(Isoc) MxPS=   9 Ivl=1ms
I:* If#= 1 Alt= 2 #EPs= 2 Cls=e0(wlcon) Sub=01 Prot=01 Driver=btusb
E:  Ad=83(I) Atr=01(Isoc) MxPS=  17 Ivl=1ms
E:  Ad=03(O) Atr=01(Isoc) MxPS=  17 Ivl=1ms
I:  If#= 1 Alt= 3 #EPs= 2 Cls=e0(wlcon) Sub=01 Prot=01 Driver=btusb
E:  Ad=83(I) Atr=01(Isoc) MxPS=  25 Ivl=1ms
E:  Ad=03(O) Atr=01(Isoc) MxPS=  25 Ivl=1ms
I:  If#= 1 Alt= 4 #EPs= 2 Cls=e0(wlcon) Sub=01 Prot=01 Driver=btusb
E:  Ad=83(I) Atr=01(Isoc) MxPS=  33 Ivl=1ms
E:  Ad=03(O) Atr=01(Isoc) MxPS=  33 Ivl=1ms
I:  If#= 1 Alt= 5 #EPs= 2 Cls=e0(wlcon) Sub=01 Prot=01 Driver=btusb
E:  Ad=83(I) Atr=01(Isoc) MxPS=  49 Ivl=1ms
E:  Ad=03(O) Atr=01(Isoc) MxPS=  49 Ivl=1ms
I:  If#= 1 Alt= 6 #EPs= 2 Cls=e0(wlcon) Sub=01 Prot=01 Driver=btusb
E:  Ad=83(I) Atr=01(Isoc) MxPS=  63 Ivl=1ms
E:  Ad=03(O) Atr=01(Isoc) MxPS=  63 Ivl=1ms
I:  If#= 1 Alt= 7 #EPs= 2 Cls=e0(wlcon) Sub=01 Prot=01 Driver=btusb
E:  Ad=83(I) Atr=01(Isoc) MxPS=  65 Ivl=1ms
E:  Ad=03(O) Atr=01(Isoc) MxPS=  65 Ivl=1ms

Signed-off-by: Aaron Ma <aaron.ma@canonical.com>
Signed-off-by: Marcel Holtmann <marcel@holtmann.org>

