USB: serial: option: add WeTelecom WM-D200

Add support for WeTelecom WM-D200.

T:  Bus=03 Lev=01 Prnt=01 Port=01 Cnt=01 Dev#=  4 Spd=12  MxCh= 0
D:  Ver= 1.10 Cls=00(>ifc ) Sub=00 Prot=00 MxPS=64 #Cfgs=  1
P:  Vendor=22de ProdID=6801 Rev=00.00
S:  Manufacturer=WeTelecom Incorporated
S:  Product=WeTelecom Mobile Products
C:  #Ifs= 4 Cfg#= 1 Atr=80 MxPwr=500mA
I:  If#= 0 Alt= 0 #EPs= 3 Cls=ff(vend.) Sub=ff Prot=ff Driver=(none)
I:  If#= 1 Alt= 0 #EPs= 2 Cls=ff(vend.) Sub=ff Prot=ff Driver=(none)
I:  If#= 2 Alt= 0 #EPs= 2 Cls=ff(vend.) Sub=ff Prot=ff Driver=(none)
I:  If#= 3 Alt= 0 #EPs= 2 Cls=08(stor.) Sub=06 Prot=50 Driver=usb-storage

Signed-off-by: Aleksandr Makarov <aleksandr.o.makarov@gmail.com>
Cc: stable <stable@vger.kernel.org>
Signed-off-by: Johan Hovold <johan@kernel.org>

