USB: option: add "4G LTE usb-modem U901"

Thomas reports:

T:  Bus=01 Lev=01 Prnt=01 Port=03 Cnt=01 Dev#=  4 Spd=480 MxCh= 0
D:  Ver= 2.00 Cls=00(>ifc ) Sub=00 Prot=00 MxPS=64 #Cfgs=  1
P:  Vendor=05c6 ProdID=6001 Rev=00.00
S:  Manufacturer=USB Modem
S:  Product=USB Modem
S:  SerialNumber=1234567890ABCDEF
C:  #Ifs= 5 Cfg#= 1 Atr=e0 MxPwr=500mA
I:  If#= 0 Alt= 0 #EPs= 2 Cls=ff(vend.) Sub=ff Prot=ff Driver=option
I:  If#= 1 Alt= 0 #EPs= 3 Cls=ff(vend.) Sub=ff Prot=ff Driver=option
I:  If#= 2 Alt= 0 #EPs= 2 Cls=ff(vend.) Sub=ff Prot=ff Driver=option
I:  If#= 3 Alt= 0 #EPs= 3 Cls=ff(vend.) Sub=ff Prot=ff Driver=qmi_wwan
I:  If#= 4 Alt= 0 #EPs= 2 Cls=08(stor.) Sub=06 Prot=50 Driver=usb-storage

Cc: <stable@vger.kernel.org>
Reported-by: Thomas Schäfer <tschaefer@t-online.de>
Signed-off-by: Bjørn Mork <bjorn@mork.no>
Signed-off-by: Johan Hovold <johan@kernel.org>

