USB: serial: option: add device id for Foxconn T99W265

Adding support for Foxconn device T99W265 for enumeration with
PID 0xe0db.

usb-devices output for 0xe0db
T:  Bus=04 Lev=01 Prnt=01 Port=00 Cnt=01 Dev#= 19 Spd=5000 MxCh= 0
D:  Ver= 3.20 Cls=ef(misc ) Sub=02 Prot=01 MxPS= 9 #Cfgs=  1
P:  Vendor=0489 ProdID=e0db Rev=05.04
S:  Manufacturer=Microsoft
S:  Product=Generic Mobile Broadband Adapter
S:  SerialNumber=6c50f452
C:  #Ifs= 5 Cfg#= 1 Atr=a0 MxPwr=896mA
I:  If#=0x0 Alt= 0 #EPs= 1 Cls=02(commc) Sub=0e Prot=00 Driver=cdc_mbim
I:  If#=0x1 Alt= 1 #EPs= 2 Cls=0a(data ) Sub=00 Prot=02 Driver=cdc_mbim
I:  If#=0x2 Alt= 0 #EPs= 3 Cls=ff(vend.) Sub=ff Prot=40 Driver=option
I:  If#=0x3 Alt= 0 #EPs= 1 Cls=ff(vend.) Sub=ff Prot=ff Driver=(none)
I:  If#=0x4 Alt= 0 #EPs= 2 Cls=ff(vend.) Sub=ff Prot=30 Driver=option

if0/1: MBIM, if2:Diag, if3:GNSS, if4: Modem

Signed-off-by: Slark Xiao <slark_xiao@163.com>
Link: https://lore.kernel.org/r/20210917110106.9852-1-slark_xiao@163.com
[ johan: use USB_DEVICE_INTERFACE_CLASS(), amend comment ]
Cc: stable@vger.kernel.org
Signed-off-by: Johan Hovold <johan@kernel.org>

