Bluetooth: Add support for Intel Bluetooth device 9460/9560 [8087:0aaa]

This patch adds support for Intel Bluetooth device 9460/9560 also known
as Jefferson Peak (JfP). The firmware downloading mechanism is same as
previous generation. So include the new USB product identifier and
whitelist the hardware variant.

T:  Bus=01 Lev=01 Prnt=01 Port=09 Cnt=04 Dev#=  5 Spd=12   MxCh= 0
D:  Ver= 2.01 Cls=e0(wlcon) Sub=01 Prot=01 MxPS=64 #Cfgs=  1
P:  Vendor=8087 ProdID=0aaa Rev= 0.02
C:* #Ifs= 2 Cfg#= 1 Atr=e0 MxPwr=100mA
I:* If#= 0 Alt= 0 #EPs= 3 Cls=e0(wlcon) Sub=01 Prot=01 Driver=btusb
E:  Ad=81(I) Atr=03(Int.) MxPS=  64 Ivl=1ms
E:  Ad=02(O) Atr=02(Bulk) MxPS=  64 Ivl=0ms
E:  Ad=82(I) Atr=02(Bulk) MxPS=  64 Ivl=0ms
I:* If#= 1 Alt= 0 #EPs= 2 Cls=e0(wlcon) Sub=01 Prot=01 Driver=btusb
E:  Ad=03(O) Atr=01(Isoc) MxPS=   0 Ivl=1ms
E:  Ad=83(I) Atr=01(Isoc) MxPS=   0 Ivl=1ms
I:  If#= 1 Alt= 1 #EPs= 2 Cls=e0(wlcon) Sub=01 Prot=01 Driver=btusb
E:  Ad=03(O) Atr=01(Isoc) MxPS=   9 Ivl=1ms
E:  Ad=83(I) Atr=01(Isoc) MxPS=   9 Ivl=1ms
I:  If#= 1 Alt= 2 #EPs= 2 Cls=e0(wlcon) Sub=01 Prot=01 Driver=btusb
E:  Ad=03(O) Atr=01(Isoc) MxPS=  17 Ivl=1ms
E:  Ad=83(I) Atr=01(Isoc) MxPS=  17 Ivl=1ms
I:  If#= 1 Alt= 3 #EPs= 2 Cls=e0(wlcon) Sub=01 Prot=01 Driver=btusb
E:  Ad=03(O) Atr=01(Isoc) MxPS=  25 Ivl=1ms
E:  Ad=83(I) Atr=01(Isoc) MxPS=  25 Ivl=1ms
I:  If#= 1 Alt= 4 #EPs= 2 Cls=e0(wlcon) Sub=01 Prot=01 Driver=btusb
E:  Ad=03(O) Atr=01(Isoc) MxPS=  33 Ivl=1ms
E:  Ad=83(I) Atr=01(Isoc) MxPS=  33 Ivl=1ms
I:  If#= 1 Alt= 5 #EPs= 2 Cls=e0(wlcon) Sub=01 Prot=01 Driver=btusb
E:  Ad=03(O) Atr=01(Isoc) MxPS=  49 Ivl=1ms
E:  Ad=83(I) Atr=01(Isoc) MxPS=  49 Ivl=1ms
I:  If#= 1 Alt= 6 #EPs= 2 Cls=e0(wlcon) Sub=01 Prot=01 Driver=btusb
E:  Ad=03(O) Atr=01(Isoc) MxPS=  63 Ivl=1ms
E:  Ad=83(I) Atr=01(Isoc) MxPS=  63 Ivl=1ms

Bootloader version:
< HCI Command: Intel Read Version (0x3f|0x0005) plen 0
> HCI Event: Command Complete (0x0e) plen 13
      Intel Read Version (0x3f|0x0005) ncmd 32
        Status: Success (0x00)
        Hardware platform: 0x37
        Hardware variant: 0x11
        Hardware revision: 0.0
        Firmware variant: 0x06
        Firmware revision: 0.1
        Firmware build: 42-52.2015
        Firmware patch: 0

Signed-off-by: Tedd Ho-Jeong An <tedd.an@intel.com>
Signed-off-by: Marcel Holtmann <marcel@holtmann.org>

