USB: serial: option: Adding support for Cinterion MV31

Adding support for Cinterion device MV31 for enumeration with
PID 0x00B3 and 0x00B7.

usb-devices output for 0x00B3
T:  Bus=04 Lev=01 Prnt=01 Port=00 Cnt=01 Dev#=  6 Spd=5000 MxCh= 0
D:  Ver= 3.20 Cls=ef(misc ) Sub=02 Prot=01 MxPS= 9 #Cfgs=  1
P:  Vendor=1e2d ProdID=00b3 Rev=04.14
S:  Manufacturer=Cinterion
S:  Product=Cinterion PID 0x00B3 USB Mobile Broadband
S:  SerialNumber=b3246eed
C:  #Ifs= 6 Cfg#= 1 Atr=a0 MxPwr=896mA
I:  If#=0x0 Alt= 0 #EPs= 1 Cls=02(commc) Sub=0e Prot=00 Driver=cdc_mbim
I:  If#=0x1 Alt= 1 #EPs= 2 Cls=0a(data ) Sub=00 Prot=02 Driver=cdc_mbim
I:  If#=0x2 Alt= 0 #EPs= 3 Cls=ff(vend.) Sub=00 Prot=00 Driver=option
I:  If#=0x3 Alt= 0 #EPs= 1 Cls=ff(vend.) Sub=ff Prot=ff Driver=cdc_wdm
I:  If#=0x4 Alt= 0 #EPs= 3 Cls=ff(vend.) Sub=00 Prot=00 Driver=option
I:  If#=0x5 Alt= 0 #EPs= 2 Cls=ff(vend.) Sub=ff Prot=30 Driver=option

usb-devices output for 0x00B7
T:  Bus=04 Lev=01 Prnt=01 Port=00 Cnt=01 Dev#=  5 Spd=5000 MxCh= 0
D:  Ver= 3.20 Cls=ef(misc ) Sub=02 Prot=01 MxPS= 9 #Cfgs=  1
P:  Vendor=1e2d ProdID=00b7 Rev=04.14
S:  Manufacturer=Cinterion
S:  Product=Cinterion PID 0x00B3 USB Mobile Broadband
S:  SerialNumber=b3246eed
C:  #Ifs= 4 Cfg#= 1 Atr=a0 MxPwr=896mA
I:  If#=0x0 Alt= 0 #EPs= 3 Cls=ff(vend.) Sub=ff Prot=ff Driver=qmi_wwan
I:  If#=0x1 Alt= 0 #EPs= 3 Cls=ff(vend.) Sub=00 Prot=00 Driver=option
I:  If#=0x2 Alt= 0 #EPs= 3 Cls=ff(vend.) Sub=00 Prot=00 Driver=option
I:  If#=0x3 Alt= 0 #EPs= 2 Cls=ff(vend.) Sub=ff Prot=30 Driver=option

Signed-off-by: Christoph Schemmel <christoph.schemmel@gmail.com>
Cc: stable@vger.kernel.org
Signed-off-by: Johan Hovold <johan@kernel.org>

