Bluetooth: Add support for Foxconn/Hon Hai [0489:e04d]

Add support for the AR3012 chip.

T:  Bus=01 Lev=02 Prnt=02 Port=05 Cnt=03 Dev#= 21 Spd=12  MxCh= 0
D:  Ver= 1.10 Cls=e0(wlcon) Sub=01 Prot=01 MxPS=64 #Cfgs=  1
P:  Vendor=0489 ProdID=e04d Rev=00.02
S:  Manufacturer=Atheros Communications
S:  Product=Bluetooth USB Host Controller
S:  SerialNumber=Alaska Day 2006
C:  #Ifs= 2 Cfg#= 1 Atr=e0 MxPwr=100mA
I:  If#= 0 Alt= 0 #EPs= 3 Cls=e0(wlcon) Sub=01 Prot=01 Driver=btusb
I:  If#= 1 Alt= 0 #EPs= 2 Cls=e0(wlcon) Sub=01 Prot=01 Driver=btusb

Signed-off-by: Noguchi Kazutosi <linux@scaltinof.net>
Signed-off-by: Gustavo Padovan <gustavo.padovan@collabora.co.uk>

