USB: serial: option: add HP lt4132

The HP lt4132 is a rebranded Huawei ME906s-158 LTE modem.

The interface with protocol 0x16 is "CDC ECM & NCM" according to the *.inf
files included with the Windows driver. Attaching the option driver to it
doesn't result in a /dev/ttyUSB* device being created, so I've excluded it.
Note that it is also excluded for corresponding Huawei-branded devices, cf.
commit d544db293a44 ("USB: support new huawei devices in option.c").

T:  Bus=01 Lev=01 Prnt=01 Port=02 Cnt=02 Dev#=  3 Spd=480 MxCh= 0
D:  Ver= 2.00 Cls=00(>ifc ) Sub=00 Prot=ff MxPS=64 #Cfgs=  3
P:  Vendor=03f0 ProdID=a31d Rev=01.02
S:  Manufacturer=HP Inc.
S:  Product=HP lt4132 LTE/HSPA+ 4G Module
S:  SerialNumber=0123456789ABCDEF
C:  #Ifs= 6 Cfg#= 1 Atr=a0 MxPwr=2mA
I:  If#=0x0 Alt= 0 #EPs= 3 Cls=ff(vend.) Sub=06 Prot=10 Driver=option
I:  If#=0x1 Alt= 0 #EPs= 2 Cls=ff(vend.) Sub=06 Prot=13 Driver=option
I:  If#=0x2 Alt= 0 #EPs= 2 Cls=ff(vend.) Sub=06 Prot=12 Driver=option
I:  If#=0x3 Alt= 0 #EPs= 1 Cls=ff(vend.) Sub=06 Prot=16 Driver=(none)
I:  If#=0x4 Alt= 0 #EPs= 2 Cls=ff(vend.) Sub=06 Prot=14 Driver=option
I:  If#=0x5 Alt= 0 #EPs= 2 Cls=ff(vend.) Sub=06 Prot=1b Driver=option

T:  Bus=01 Lev=01 Prnt=01 Port=02 Cnt=02 Dev#=  3 Spd=480 MxCh= 0
D:  Ver= 2.00 Cls=00(>ifc ) Sub=00 Prot=ff MxPS=64 #Cfgs=  3
P:  Vendor=03f0 ProdID=a31d Rev=01.02
S:  Manufacturer=HP Inc.
S:  Product=HP lt4132 LTE/HSPA+ 4G Module
S:  SerialNumber=0123456789ABCDEF
C:  #Ifs= 7 Cfg#= 2 Atr=a0 MxPwr=2mA
I:  If#=0x0 Alt= 0 #EPs= 1 Cls=02(commc) Sub=06 Prot=00 Driver=cdc_ether
I:  If#=0x1 Alt= 0 #EPs= 2 Cls=0a(data ) Sub=06 Prot=00 Driver=cdc_ether
I:  If#=0x2 Alt= 0 #EPs= 3 Cls=ff(vend.) Sub=06 Prot=10 Driver=option
I:  If#=0x3 Alt= 0 #EPs= 2 Cls=ff(vend.) Sub=06 Prot=13 Driver=option
I:  If#=0x4 Alt= 0 #EPs= 2 Cls=ff(vend.) Sub=06 Prot=12 Driver=option
I:  If#=0x5 Alt= 0 #EPs= 2 Cls=ff(vend.) Sub=06 Prot=14 Driver=option
I:  If#=0x6 Alt= 0 #EPs= 2 Cls=ff(vend.) Sub=06 Prot=1b Driver=option

T:  Bus=01 Lev=01 Prnt=01 Port=02 Cnt=02 Dev#=  3 Spd=480 MxCh= 0
D:  Ver= 2.00 Cls=00(>ifc ) Sub=00 Prot=ff MxPS=64 #Cfgs=  3
P:  Vendor=03f0 ProdID=a31d Rev=01.02
S:  Manufacturer=HP Inc.
S:  Product=HP lt4132 LTE/HSPA+ 4G Module
S:  SerialNumber=0123456789ABCDEF
C:  #Ifs= 3 Cfg#= 3 Atr=a0 MxPwr=2mA
I:  If#=0x0 Alt= 0 #EPs= 1 Cls=02(commc) Sub=0e Prot=00 Driver=cdc_mbim
I:  If#=0x1 Alt= 1 #EPs= 2 Cls=0a(data ) Sub=00 Prot=02 Driver=cdc_mbim
I:  If#=0x2 Alt= 0 #EPs= 2 Cls=ff(vend.) Sub=06 Prot=14 Driver=option

Signed-off-by: Tore Anderson <tore@fud.no>
Cc: stable@vger.kernel.org
[ johan: drop id defines ]
Signed-off-by: Johan Hovold <johan@kernel.org>

