HID: Add quirks for Trust Panora Graphic Tablet

The Trust Panora Graphic Tablet has two interfaces. Interface zero reports pen
movement, pen pressure and pen buttons. Interface one reports tablet buttons
and tablet scroll. Both use the mouse protocol.

Without these quirks, libinput gets confused about what device it talks to.

For completeness, here is the usbhid-dump:

```
$ sudo usbhid-dump -d 145f:0212
003:013:001:DESCRIPTOR         1588949402.559961
 05 0D 09 01 A1 01 85 07 A1 02 09 00 75 08 95 07
 81 02 C0 C0 09 0E A1 01 85 05 09 23 A1 02 09 52
 09 53 25 0A 75 08 95 02 B1 02 C0 C0 05 0C 09 36
 A1 00 85 06 05 09 19 01 29 20 15 00 25 01 95 20
 75 01 81 02 C0

003:013:000:DESCRIPTOR         1588949402.563942
 05 01 09 02 A1 01 85 08 09 01 A1 00 05 09 19 01
 29 03 15 00 25 01 95 03 75 01 81 02 95 05 81 01
 05 01 09 30 09 31 09 38 09 00 15 81 25 7F 75 08
 95 04 81 06 C0 C0 05 01 09 02 A1 01 85 09 09 01
 A1 00 05 09 19 01 29 03 15 00 25 01 95 03 75 01
 81 02 95 05 81 01 05 01 09 30 09 31 26 FF 7F 95
 02 75 10 81 02 05 0D 09 30 26 FF 03 95 01 75 10
 81 02 C0 C0 05 01 09 00 A1 01 85 04 A1 00 26 FF
 00 09 00 75 08 95 07 B1 02 C0 C0
```

Signed-off-by: Cristian Klein <cristian.klein@elastisys.com>
Signed-off-by: Jiri Kosina <jkosina@suse.cz>

