USB: option: add 2020:4000 ID

Add device Olivetti Olicard 300 (Network Connect: MT6225) - IDs 2020:4000.

T:  Bus=01 Lev=02 Prnt=04 Port=00 Cnt=01 Dev#= 10 Spd=480 MxCh= 0
D:  Ver= 2.00 Cls=ef(misc ) Sub=02 Prot=01 MxPS=64 #Cfgs=  1
P:  Vendor=2020 ProdID=4000 Rev=03.00
S:  Manufacturer=Network Connect
S:  Product=MT6225
C:  #Ifs= 7 Cfg#= 1 Atr=a0 MxPwr=500mA
I:  If#= 0 Alt= 0 #EPs= 1 Cls=02(commc) Sub=0e Prot=00 Driver=cdc_mbim
I:  If#= 1 Alt= 1 #EPs= 2 Cls=0a(data ) Sub=00 Prot=02 Driver=cdc_mbim
I:  If#= 2 Alt= 0 #EPs= 3 Cls=ff(vend.) Sub=02 Prot=01 Driver=option
I:  If#= 3 Alt= 0 #EPs= 2 Cls=ff(vend.) Sub=00 Prot=00 Driver=option
I:  If#= 4 Alt= 0 #EPs= 2 Cls=ff(vend.) Sub=00 Prot=00 Driver=option
I:  If#= 5 Alt= 0 #EPs= 2 Cls=ff(vend.) Sub=00 Prot=00 Driver=option
I:  If#= 6 Alt= 0 #EPs= 2 Cls=08(stor.) Sub=06 Prot=50 Driver=usb-storage

Signed-off-by: Claudio Cappelli <claudio.cappelli.linux@gmail.com>
Suggested-by: Lars Melin <larsm17@gmail.com>
Cc: stable <stable@vger.kernel.org>
[johan: amend commit message with devices info ]
Signed-off-by: Johan Hovold <johan@kernel.org>

