Bluetooth: Add support for atheros 04ca:3004 device to ath3k

Yet another version of the atheros bluetooth chipset

T:  Bus=01 Lev=02 Prnt=02 Port=03 Cnt=01 Dev#=  3 Spd=12  MxCh= 0
D:  Ver= 1.10 Cls=e0(wlcon) Sub=01 Prot=01 MxPS=64 #Cfgs=  1
P:  Vendor=04ca ProdID=3004 Rev=00.01
S:  Manufacturer=Atheros Communications
S:  Product=Bluetooth USB Host Controller
S:  SerialNumber=Alaska Day 2006
C:  #Ifs= 2 Cfg#= 1 Atr=e0 MxPwr=100mA
I:  If#= 0 Alt= 0 #EPs= 3 Cls=e0(wlcon) Sub=01 Prot=01 Driver=btusb
I:  If#= 1 Alt= 0 #EPs= 2 Cls=e0(wlcon) Sub=01 Prot=01 Driver=btusb

This resolves https://bugzilla.redhat.com/show_bug.cgi?id=844750

Reported-by: niktr@mail.ru
Signed-off-by: Josh Boyer <jwboyer@redhat.com>
Signed-off-by: Gustavo Padovan <gustavo.padovan@collabora.co.uk>

