USB: option: add "D-Link DWM-221 B1" device id

Thomas reports:
"Windows:

00 diagnostics
01 modem
02 at-port
03 nmea
04 nic

Linux:

T:  Bus=02 Lev=01 Prnt=01 Port=03 Cnt=01 Dev#=  4 Spd=480 MxCh= 0
D:  Ver= 2.00 Cls=00(>ifc ) Sub=00 Prot=00 MxPS=64 #Cfgs=  1
P:  Vendor=2001 ProdID=7e19 Rev=02.32
S:  Manufacturer=Mobile Connect
S:  Product=Mobile Connect
S:  SerialNumber=0123456789ABCDEF
C:  #Ifs= 6 Cfg#= 1 Atr=a0 MxPwr=500mA
I:  If#= 0 Alt= 0 #EPs= 2 Cls=ff(vend.) Sub=ff Prot=ff Driver=option
I:  If#= 1 Alt= 0 #EPs= 3 Cls=ff(vend.) Sub=00 Prot=00 Driver=option
I:  If#= 2 Alt= 0 #EPs= 3 Cls=ff(vend.) Sub=00 Prot=00 Driver=option
I:  If#= 3 Alt= 0 #EPs= 3 Cls=ff(vend.) Sub=00 Prot=00 Driver=option
I:  If#= 4 Alt= 0 #EPs= 3 Cls=ff(vend.) Sub=ff Prot=ff Driver=qmi_wwan
I:  If#= 5 Alt= 0 #EPs= 2 Cls=08(stor.) Sub=06 Prot=50 Driver=usb-storage"

Reported-by: Thomas Schäfer <tschaefer@t-online.de>
Cc: <stable@vger.kernel.org>
Signed-off-by: Bjørn Mork <bjorn@mork.no>
Signed-off-by: Johan Hovold <johan@kernel.org>

