Bluetooth: Add support for Mediatek Bluetooth device [0e8d:763f]

This patch adds support for Mediatek Bluetooth device

T:  Bus=02 Lev=01 Prnt=01 Port=03 Cnt=01 Dev#=  2 Spd=480  MxCh= 0
D:  Ver= 2.01 Cls=ef(misc ) Sub=02 Prot=01 MxPS=64 #Cfgs=  1
P:  Vendor=0e8d ProdID=763f Rev= 1.00
S:  Manufacturer=MediaTek
S:  Product=BT
S:  SerialNumber=1.0
C:* #Ifs= 2 Cfg#= 1 Atr=a0 MxPwr=450mA
A:  FirstIf#= 0 IfCount= 2 Cls=ff(vend.) Sub=ff Prot=ff
I:* If#= 0 Alt= 0 #EPs= 3 Cls=ff(vend.) Sub=ff Prot=ff Driver=(none)
E:  Ad=81(I) Atr=03(Int.) MxPS=  16 Ivl=125us
E:  Ad=02(O) Atr=02(Bulk) MxPS= 512 Ivl=125us
E:  Ad=82(I) Atr=02(Bulk) MxPS= 512 Ivl=0ms
I:* If#= 1 Alt= 0 #EPs= 2 Cls=ff(vend.) Sub=ff Prot=ff Driver=(none)
E:  Ad=03(O) Atr=01(Isoc) MxPS=   0 Ivl=1ms
E:  Ad=83(I) Atr=01(Isoc) MxPS=   0 Ivl=1ms
I:  If#= 1 Alt= 1 #EPs= 2 Cls=ff(vend.) Sub=ff Prot=ff Driver=(none)
E:  Ad=03(O) Atr=01(Isoc) MxPS=   9 Ivl=1ms
E:  Ad=83(I) Atr=01(Isoc) MxPS=   9 Ivl=1ms
I:  If#= 1 Alt= 2 #EPs= 2 Cls=ff(vend.) Sub=ff Prot=ff Driver=(none)
E:  Ad=03(O) Atr=01(Isoc) MxPS=  17 Ivl=1ms
E:  Ad=83(I) Atr=01(Isoc) MxPS=  17 Ivl=1ms
I:  If#= 1 Alt= 3 #EPs= 2 Cls=ff(vend.) Sub=ff Prot=ff Driver=(none)
E:  Ad=03(O) Atr=01(Isoc) MxPS=  25 Ivl=1ms
E:  Ad=83(I) Atr=01(Isoc) MxPS=  25 Ivl=1ms
I:  If#= 1 Alt= 4 #EPs= 2 Cls=ff(vend.) Sub=ff Prot=ff Driver=(none)
E:  Ad=03(O) Atr=01(Isoc) MxPS=  33 Ivl=1ms
E:  Ad=83(I) Atr=01(Isoc) MxPS=  33 Ivl=1ms
I:  If#= 1 Alt= 5 #EPs= 2 Cls=ff(vend.) Sub=ff Prot=ff Driver=(none)
E:  Ad=03(O) Atr=01(Isoc) MxPS=  49 Ivl=1ms
E:  Ad=83(I) Atr=01(Isoc) MxPS=  49 Ivl=1ms
I:  If#= 1 Alt= 6 #EPs= 2 Cls=ff(vend.) Sub=ff Prot=ff Driver=(none)
E:  Ad=03(O) Atr=01(Isoc) MxPS=  63 Ivl=1ms
E:  Ad=83(I) Atr=01(Isoc) MxPS=  63 Ivl=1ms

Signed-off-by: Cho, Yu-Chen <acho@suse.com>
Signed-off-by: Gustavo Padovan <gustavo.padovan@collabora.co.uk>
Signed-off-by: John W. Linville <linville@tuxdriver.com>

