Bluetooth: ath3k: Add support for ID 0x13d3/0x3402

T:  Bus=01 Lev=02 Prnt=02 Port=00 Cnt=01 Dev#=  5 Spd=12   MxCh= 0
D:  Ver= 1.10 Cls=e0(wlcon) Sub=01 Prot=01 MxPS=64 #Cfgs=  1
P:  Vendor=13d3 ProdID=3402 Rev= 0.02
S:  Manufacturer=Atheros Communications
S:  Product=Bluetooth USB Host Controller
S:  SerialNumber=Alaska Day 2006
C:* #Ifs= 2 Cfg#= 1 Atr=e0 MxPwr=100mA
I:* If#= 0 Alt= 0 #EPs= 3 Cls=e0(wlcon) Sub=01 Prot=01 Driver=btusb

Bug: https://bugzilla.kernel.org/show_bug.cgi?id=59701

Signed-off-by: Sujith Manoharan <sujith@msujith.org>
Signed-off-by: Gustavo Padovan <gustavo.padovan@collabora.co.uk>

