Bluetooth: btusb: Add support for Intel Bluetooth devices 9160/9260 [8087:0025]

The new Bluetooth devices 9160/9260 (also known as ThunderPeak)
devices from Intel use the same firmware loading mechanism as previous
generation. So include the new USB product identifier and whitelist
the hardware variant.

T:  Bus=02 Lev=02 Prnt=03 Port=00 Cnt=01 Dev#=  8 Spd=12   MxCh= 0
D:  Ver= 2.01 Cls=e0(wlcon) Sub=01 Prot=01 MxPS=64 #Cfgs=  1
P:  Vendor=8087 ProdID=0025 Rev= 0.02
C:* #Ifs= 2 Cfg#= 1 Atr=e0 MxPwr=100mA
I:* If#= 0 Alt= 0 #EPs= 3 Cls=e0(wlcon) Sub=01 Prot=01 Driver=btusb
E:  Ad=81(I) Atr=03(Int.) MxPS=  64 Ivl=1ms
E:  Ad=02(O) Atr=02(Bulk) MxPS=  64 Ivl=0ms
E:  Ad=82(I) Atr=02(Bulk) MxPS=  64 Ivl=0ms
I:* If#= 1 Alt= 0 #EPs= 2 Cls=e0(wlcon) Sub=01 Prot=01 Driver=btusb
E:  Ad=03(O) Atr=01(Isoc) MxPS=   0 Ivl=1ms
E:  Ad=83(I) Atr=01(Isoc) MxPS=   0 Ivl=1ms
I:  If#= 1 Alt= 1 #EPs= 2 Cls=e0(wlcon) Sub=01 Prot=01 Driver=btusb
E:  Ad=03(O) Atr=01(Isoc) MxPS=   9 Ivl=1ms
E:  Ad=83(I) Atr=01(Isoc) MxPS=   9 Ivl=1ms
I:  If#= 1 Alt= 2 #EPs= 2 Cls=e0(wlcon) Sub=01 Prot=01 Driver=btusb
E:  Ad=03(O) Atr=01(Isoc) MxPS=  17 Ivl=1ms
E:  Ad=83(I) Atr=01(Isoc) MxPS=  17 Ivl=1ms
I:  If#= 1 Alt= 3 #EPs= 2 Cls=e0(wlcon) Sub=01 Prot=01 Driver=btusb
E:  Ad=03(O) Atr=01(Isoc) MxPS=  25 Ivl=1ms
E:  Ad=83(I) Atr=01(Isoc) MxPS=  25 Ivl=1ms
I:  If#= 1 Alt= 4 #EPs= 2 Cls=e0(wlcon) Sub=01 Prot=01 Driver=btusb
E:  Ad=03(O) Atr=01(Isoc) MxPS=  33 Ivl=1ms
E:  Ad=83(I) Atr=01(Isoc) MxPS=  33 Ivl=1ms
I:  If#= 1 Alt= 5 #EPs= 2 Cls=e0(wlcon) Sub=01 Prot=01 Driver=btusb
E:  Ad=03(O) Atr=01(Isoc) MxPS=  49 Ivl=1ms
E:  Ad=83(I) Atr=01(Isoc) MxPS=  49 Ivl=1ms
I:  If#= 1 Alt= 6 #EPs= 2 Cls=e0(wlcon) Sub=01 Prot=01 Driver=btusb
E:  Ad=03(O) Atr=01(Isoc) MxPS=  63 Ivl=1ms
E:  Ad=83(I) Atr=01(Isoc) MxPS=  63 Ivl=1ms

Bluetooth: hci0: Bootloader revision 0.1 build 42 week 52 2015
Bluetooth: hci0: Device revision is 2
Bluetooth: hci0: Secure boot is enabled
Bluetooth: hci0: OTP lock is disabled
Bluetooth: hci0: API lock is disabled
Bluetooth: hci0: Debug lock is disabled
Bluetooth: hci0: Minimum firmware build 1 week 10 2014

< HCI Command: Read Local Version Information (0x04|0x0001) plen 0
> HCI Event: Command Complete (0x0e) plen 12
      Read Local Version Information (0x04|0x0001) ncmd 1
        Status: Success (0x00)
        HCI version: Bluetooth 5.0 (0x09) - Revision 256 (0x0100)
        LMP version: Bluetooth 5.0 (0x09) - Subversion 256 (0x0100)
        Manufacturer: Intel Corp. (2)

Based on original patch from Jaya Praveen G <jaya.p.g@linux.intel.com>

Signed-off-by: Marcel Holtmann <marcel@holtmann.org>
Tested-by: Tedd Ho-Jeong An <tedd.an@intel.com>
Signed-off-by: Tedd Ho-Jeong An <tedd.an@intel.com>
Signed-off-by: Marcel Holtmann <marcel@holtmann.org>

