USB: option: add support for SIM7100E

$ lsusb:
Bus 001 Device 101: ID 1e0e:9001 Qualcomm / Option

$ usb-devices:
T:  Bus=01 Lev=02 Prnt=02 Port=00 Cnt=01 Dev#=101 Spd=480  MxCh= 0
D:  Ver= 2.00 Cls=00(>ifc ) Sub=00 Prot=00 MxPS=64 #Cfgs=  2
P:  Vendor=1e0e ProdID=9001 Rev= 2.32
S:  Manufacturer=SimTech, Incorporated
S:  Product=SimTech, Incorporated
S:  SerialNumber=0123456789ABCDEF
C:* #Ifs= 7 Cfg#= 1 Atr=80 MxPwr=500mA
I:* If#= 0 Alt= 0 #EPs= 2 Cls=ff(vend.) Sub=ff Prot=ff Driver=option
I:* If#= 1 Alt= 0 #EPs= 3 Cls=ff(vend.) Sub=00 Prot=00 Driver=option
I:* If#= 2 Alt= 0 #EPs= 3 Cls=ff(vend.) Sub=00 Prot=00 Driver=option
I:* If#= 3 Alt= 0 #EPs= 3 Cls=ff(vend.) Sub=00 Prot=00 Driver=option
I:* If#= 4 Alt= 0 #EPs= 3 Cls=ff(vend.) Sub=00 Prot=00 Driver=option
I:* If#= 5 Alt= 0 #EPs= 3 Cls=ff(vend.) Sub=ff Prot=ff Driver=qmi_wwan
I:* If#= 6 Alt= 0 #EPs= 2 Cls=ff(vend.) Sub=42 Prot=01 Driver=(none)

The last interface (6) is used for Android Composite ADB interface.

Serial port layout:
0: QCDM/DIAG
1: NMEA
2: AT
3: AT/PPP
4: audio

Signed-off-by: Andrey Skvortsov <andrej.skvortzov@gmail.com>
Cc: stable <stable@vger.kernel.org>
Signed-off-by: Johan Hovold <johan@kernel.org>

