USB: option: add support for DW5821e

The device exposes AT, NMEA and DIAG ports in both USB configurations.

The patch explicitly ignores interfaces 0 and 1, as they're bound to
other drivers already; and also interface 6, which is a GNSS interface
for which we don't have a driver yet.

T:  Bus=01 Lev=03 Prnt=04 Port=00 Cnt=01 Dev#= 18 Spd=480 MxCh= 0
D:  Ver= 2.10 Cls=ef(misc ) Sub=02 Prot=01 MxPS=64 #Cfgs=  2
P:  Vendor=413c ProdID=81d7 Rev=03.18
S:  Manufacturer=DELL
S:  Product=DW5821e Snapdragon X20 LTE
S:  SerialNumber=0123456789ABCDEF
C:  #Ifs= 7 Cfg#= 2 Atr=a0 MxPwr=500mA
I:  If#= 0 Alt= 0 #EPs= 1 Cls=02(commc) Sub=0e Prot=00 Driver=cdc_mbim
I:  If#= 1 Alt= 1 #EPs= 2 Cls=0a(data ) Sub=00 Prot=02 Driver=cdc_mbim
I:  If#= 2 Alt= 0 #EPs= 3 Cls=ff(vend.) Sub=00 Prot=00 Driver=option
I:  If#= 3 Alt= 0 #EPs= 3 Cls=ff(vend.) Sub=00 Prot=00 Driver=option
I:  If#= 4 Alt= 0 #EPs= 3 Cls=ff(vend.) Sub=00 Prot=00 Driver=option
I:  If#= 5 Alt= 0 #EPs= 2 Cls=ff(vend.) Sub=ff Prot=ff Driver=option
I:  If#= 6 Alt= 0 #EPs= 1 Cls=ff(vend.) Sub=ff Prot=ff Driver=(none)

T:  Bus=01 Lev=03 Prnt=04 Port=00 Cnt=01 Dev#= 16 Spd=480 MxCh= 0
D:  Ver= 2.10 Cls=ef(misc ) Sub=02 Prot=01 MxPS=64 #Cfgs=  2
P:  Vendor=413c ProdID=81d7 Rev=03.18
S:  Manufacturer=DELL
S:  Product=DW5821e Snapdragon X20 LTE
S:  SerialNumber=0123456789ABCDEF
C:  #Ifs= 6 Cfg#= 1 Atr=a0 MxPwr=500mA
I:  If#= 0 Alt= 0 #EPs= 3 Cls=ff(vend.) Sub=ff Prot=ff Driver=qmi_wwan
I:  If#= 1 Alt= 0 #EPs= 1 Cls=03(HID  ) Sub=00 Prot=00 Driver=usbhid
I:  If#= 2 Alt= 0 #EPs= 3 Cls=ff(vend.) Sub=00 Prot=00 Driver=option
I:  If#= 3 Alt= 0 #EPs= 3 Cls=ff(vend.) Sub=00 Prot=00 Driver=option
I:  If#= 4 Alt= 0 #EPs= 3 Cls=ff(vend.) Sub=00 Prot=00 Driver=option
I:  If#= 5 Alt= 0 #EPs= 2 Cls=ff(vend.) Sub=ff Prot=ff Driver=option

Signed-off-by: Aleksander Morgado <aleksander@aleksander.es>
Cc: stable <stable@vger.kernel.org>
Signed-off-by: Greg Kroah-Hartman <gregkh@linuxfoundation.org>

