NET: usb: qmi_wwan: Adding support for Cinterion MV31

Adding support for Cinterion MV31 with PID 0x00B7.

T:  Bus=04 Lev=01 Prnt=01 Port=00 Cnt=01 Dev#= 11 Spd=5000 MxCh= 0
D:  Ver= 3.20 Cls=ef(misc ) Sub=02 Prot=01 MxPS= 9 #Cfgs=  1
P:  Vendor=1e2d ProdID=00b7 Rev=04.14
S:  Manufacturer=Cinterion
S:  Product=Cinterion USB Mobile Broadband
S:  SerialNumber=b3246eed
C:  #Ifs= 4 Cfg#= 1 Atr=a0 MxPwr=896mA
I:  If#=0x0 Alt= 0 #EPs= 3 Cls=ff(vend.) Sub=ff Prot=ff Driver=qmi_wwan
I:  If#=0x1 Alt= 0 #EPs= 3 Cls=ff(vend.) Sub=00 Prot=00 Driver=option
I:  If#=0x2 Alt= 0 #EPs= 3 Cls=ff(vend.) Sub=00 Prot=00 Driver=option
I:  If#=0x3 Alt= 0 #EPs= 2 Cls=ff(vend.) Sub=ff Prot=30 Driver=option

Signed-off-by: Christoph Schemmel <christoph.schemmel@gmail.com>
Link: https://lore.kernel.org/r/20210202084523.4371-1-christoph.schemmel@gmail.com
Signed-off-by: Jakub Kicinski <kuba@kernel.org>

