Bluetooth: btusb: add ID for LiteOn 04ca:3016

Contains a QCA6174A-5 chipset, with USB BT. Let's support loading
firmware on it.

From usb-devices:
T:  Bus=02 Lev=02 Prnt=02 Port=00 Cnt=01 Dev#=  3 Spd=12  MxCh= 0
D:  Ver= 2.01 Cls=e0(wlcon) Sub=01 Prot=01 MxPS=64 #Cfgs=  1
P:  Vendor=04ca ProdID=3016 Rev=00.01
C:  #Ifs= 2 Cfg#= 1 Atr=e0 MxPwr=100mA
I:  If#= 0 Alt= 0 #EPs= 3 Cls=e0(wlcon) Sub=01 Prot=01 Driver=btusb
I:  If#= 1 Alt= 0 #EPs= 2 Cls=e0(wlcon) Sub=01 Prot=01 Driver=btusb

Signed-off-by: Brian Norris <briannorris@chromium.org>
Signed-off-by: Johan Hedberg <johan.hedberg@intel.com>

