Bluetooth: ath3k: Add new AR3012 0930:021c id

This adapter works with the existing linux-firmware.

T:  Bus=01 Lev=01 Prnt=01 Port=03 Cnt=02 Dev#=  3 Spd=12  MxCh= 0
D:  Ver= 1.10 Cls=e0(wlcon) Sub=01 Prot=01 MxPS=64 #Cfgs=  1
P:  Vendor=0930 ProdID=021c Rev=00.01
C:  #Ifs= 2 Cfg#= 1 Atr=e0 MxPwr=100mA
I:  If#= 0 Alt= 0 #EPs= 3 Cls=e0(wlcon) Sub=01 Prot=01 Driver=btusb
I:  If#= 1 Alt= 0 #EPs= 2 Cls=e0(wlcon) Sub=01 Prot=01 Driver=btusb

BugLink: https://bugs.launchpad.net/bugs/1502781

Signed-off-by: Dmitry Tunin <hanipouspilot@gmail.com>
Signed-off-by: Marcel Holtmann <marcel@holtmann.org>
Cc: stable@vger.kernel.org

