USB: serial: option: add the BroadMobi BM818 card

Add a VID:PID for the BroadMobi BM818 M.2 card

T:  Bus=01 Lev=03 Prnt=40 Port=03 Cnt=01 Dev#= 44 Spd=480 MxCh= 0
D:  Ver= 2.00 Cls=00(>ifc ) Sub=00 Prot=00 MxPS=64 #Cfgs=  1
P:  Vendor=2020 ProdID=2060 Rev=00.00
S:  Manufacturer=Qualcomm, Incorporated
S:  Product=Qualcomm CDMA Technologies MSM
C:  #Ifs= 5 Cfg#= 1 Atr=e0 MxPwr=500mA
I:  If#=0x0 Alt= 0 #EPs= 2 Cls=ff(vend.) Sub=ff Prot=ff Driver=(none)
I:  If#=0x1 Alt= 0 #EPs= 2 Cls=ff(vend.) Sub=ff Prot=ff Driver=(none)
I:  If#=0x2 Alt= 0 #EPs= 3 Cls=ff(vend.) Sub=ff Prot=ff Driver=(none)
I:  If#=0x3 Alt= 0 #EPs= 3 Cls=ff(vend.) Sub=fe Prot=ff Driver=(none)
I:  If#=0x4 Alt= 0 #EPs= 3 Cls=ff(vend.) Sub=ff Prot=ff Driver=(none)

Signed-off-by: Bob Ham <bob.ham@puri.sm>
Signed-off-by: Angus Ainslie (Purism) <angus@akkea.ca>
Cc: stable <stable@vger.kernel.org>
[ johan: use USB_DEVICE_INTERFACE_CLASS() ]
Signed-off-by: Johan Hovold <johan@kernel.org>

