USB: serial: simple: add Motorola Tetra TPG2200 device id

Add new Motorola Tetra device id for Motorola Solutions TETRA PEI device

T:  Bus=02 Lev=01 Prnt=01 Port=01 Cnt=01 Dev#=  4 Spd=480 MxCh= 0
D:  Ver= 2.00 Cls=00(>ifc ) Sub=00 Prot=00 MxPS=64 #Cfgs=  1
P:  Vendor=0cad ProdID=9016 Rev=24.16
S:  Manufacturer=Motorola Solutions, Inc.
S:  Product=TETRA PEI interface
C:  #Ifs= 2 Cfg#= 1 Atr=80 MxPwr=500mA
I:  If#= 0 Alt= 0 #EPs= 2 Cls=ff(vend.) Sub=00 Prot=00 Driver=usb_serial_simple
I:  If#= 1 Alt= 0 #EPs= 2 Cls=ff(vend.) Sub=00 Prot=00 Driver=usb_serial_simple

Signed-off-by: Max Schulze <max.schulze@posteo.de>
Cc: stable <stable@vger.kernel.org>
Signed-off-by: Johan Hovold <johan@kernel.org>

