USB: serial: option: add Quectel EG95 LTE modem

Add support for Quectel Wireless Solutions Co., Ltd. EG95 LTE modem

T:  Bus=01 Lev=01 Prnt=01 Port=02 Cnt=02 Dev#=  5 Spd=480 MxCh= 0
D:  Ver= 2.00 Cls=ef(misc ) Sub=02 Prot=01 MxPS=64 #Cfgs=  1
P:  Vendor=2c7c ProdID=0195 Rev=03.18
S:  Manufacturer=Android
S:  Product=Android
C:  #Ifs= 5 Cfg#= 1 Atr=a0 MxPwr=500mA
I:  If#=0x0 Alt= 0 #EPs= 2 Cls=ff(vend.) Sub=ff Prot=ff Driver=(none)
I:  If#=0x1 Alt= 0 #EPs= 3 Cls=ff(vend.) Sub=00 Prot=00 Driver=(none)
I:  If#=0x2 Alt= 0 #EPs= 3 Cls=ff(vend.) Sub=00 Prot=00 Driver=(none)
I:  If#=0x3 Alt= 0 #EPs= 3 Cls=ff(vend.) Sub=00 Prot=00 Driver=(none)
I:  If#=0x4 Alt= 0 #EPs= 3 Cls=ff(vend.) Sub=ff Prot=ff Driver=(none)

Signed-off-by: AceLan Kao <acelan.kao@canonical.com>
Cc: stable@vger.kernel.org
Signed-off-by: Johan Hovold <johan@kernel.org>

