Bluetooth: Add firmware update for Atheros 0cf3:311f

The device is not functional without firmware.

The device without firmware:
T:  Bus=02 Lev=02 Prnt=02 Port=05 Cnt=01 Dev#=  3 Spd=12  MxCh= 0
D:  Ver= 1.10 Cls=e0(wlcon) Sub=01 Prot=01 MxPS=64 #Cfgs=  1
P:  Vendor=0cf3 ProdID=311f Rev=00.01
C:  #Ifs= 2 Cfg#= 1 Atr=e0 MxPwr=100mA
I:  If#= 0 Alt= 0 #EPs= 3 Cls=e0(wlcon) Sub=01 Prot=01 Driver=btusb
I:  If#= 1 Alt= 0 #EPs= 2 Cls=e0(wlcon) Sub=01 Prot=01 Driver=btusb

The device with firmware:
T:  Bus=02 Lev=02 Prnt=02 Port=05 Cnt=01 Dev#=  4 Spd=12  MxCh= 0
D:  Ver= 1.10 Cls=e0(wlcon) Sub=01 Prot=01 MxPS=64 #Cfgs=  1
P:  Vendor=0cf3 ProdID=3007 Rev=00.01
C:  #Ifs= 2 Cfg#= 1 Atr=e0 MxPwr=100mA
I:  If#= 0 Alt= 0 #EPs= 3 Cls=e0(wlcon) Sub=01 Prot=01 Driver=btusb
I:  If#= 1 Alt= 0 #EPs= 2 Cls=e0(wlcon) Sub=01 Prot=01 Driver=btusb

Signed-off-by: Oliver Neukum <oneukum@suse.de>
Signed-off-by: Marcel Holtmann <marcel@holtmann.org>

