USB: serial: option: add support for Novatel E371 PCIe card

Adds product ID for the Novatel E371 PCI Express Mini Card.

$ lsusb
Bus 001 Device 024: ID 1410:9011 Novatel Wireless

$ usb-devices
T:  Bus=01 Lev=01 Prnt=01 Port=03 Cnt=01 Dev#= 24 Spd=480 MxCh= 0
D:  Ver= 2.00 Cls=ef(misc ) Sub=02 Prot=01 MxPS=64 #Cfgs=  1
P:  Vendor=1410 ProdID=9011 Rev=00.03
S:  Manufacturer=Novatel Wireless, Inc.
S:  Product=Novatel Wireless HSPA
S:  SerialNumber=012773002115811
C:  #Ifs= 6 Cfg#= 1 Atr=e0 MxPwr=500mA
I:  If#= 0 Alt= 0 #EPs= 3 Cls=ff(vend.) Sub=ff Prot=ff Driver=option
I:  If#= 1 Alt= 0 #EPs= 2 Cls=ff(vend.) Sub=ff Prot=ff Driver=option
I:  If#= 2 Alt= 0 #EPs= 2 Cls=ff(vend.) Sub=ff Prot=ff Driver=option
I:  If#= 3 Alt= 0 #EPs= 2 Cls=ff(vend.) Sub=ff Prot=ff Driver=option
I:  If#= 6 Alt= 0 #EPs= 1 Cls=02(commc) Sub=06 Prot=00 Driver=cdc_ether
I:  If#= 7 Alt= 1 #EPs= 2 Cls=0a(data ) Sub=00 Prot=00 Driver=cdc_ether

Tested with kernel 3.2.0.

Signed-off-by: Alexej Starschenko <starschenko@gmail.com>
Cc: stable <stable@vger.kernel.org>
Signed-off-by: Johan Hovold <jhovold@gmail.com>
Signed-off-by: Greg Kroah-Hartman <gregkh@linuxfoundation.org>

