Bluetooth: append new supported device to the list [0b05:17d0]

The device found on Asus Z87 Expert motherboard requires firmware to work
correctly.

T:  Bus=03 Lev=01 Prnt=01 Port=03 Cnt=02 Dev#=  3 Spd=12  MxCh= 0
D:  Ver= 1.10 Cls=e0(wlcon) Sub=01 Prot=01 MxPS=64 #Cfgs=  1
P:  Vendor=0b05 ProdID=17d0 Rev=00.02
C:  #Ifs= 2 Cfg#= 1 Atr=e0 MxPwr=100mA
I:  If#= 0 Alt= 0 #EPs= 3 Cls=e0(wlcon) Sub=01 Prot=01 Driver=btusb
I:  If#= 1 Alt= 0 #EPs= 2 Cls=e0(wlcon) Sub=01 Prot=01 Driver=btusb

Signed-off-by: Andy Shevchenko <andriy.shevchenko@linux.intel.com>
Signed-off-by: Marcel Holtmann <marcel@holtmann.org>

