Bluetooth: btusb: Add Broadcom patchram support for ASUSTek devices

T:  Bus=03 Lev=01 Prnt=01 Port=06 Cnt=02 Dev#=  3 Spd=12   MxCh= 0
D:  Ver= 2.00 Cls=ff(vend.) Sub=01 Prot=01 MxPS=64 #Cfgs=  1
P:  Vendor=0b05 ProdID=17cf Rev= 1.12
S:  Manufacturer=Broadcom Corp
S:  Product=BCM20702A0
S:  SerialNumber=54271E3298CD
C:* #Ifs= 4 Cfg#= 1 Atr=e0 MxPwr=  0mA
I:* If#= 0 Alt= 0 #EPs= 3 Cls=ff(vend.) Sub=01 Prot=01 Driver=btusb
E:  Ad=81(I) Atr=03(Int.) MxPS=  16 Ivl=1ms
E:  Ad=82(I) Atr=02(Bulk) MxPS=  64 Ivl=0ms
E:  Ad=02(O) Atr=02(Bulk) MxPS=  64 Ivl=0ms
I:* If#= 1 Alt= 0 #EPs= 2 Cls=ff(vend.) Sub=01 Prot=01 Driver=btusb
E:  Ad=83(I) Atr=01(Isoc) MxPS=   0 Ivl=1ms
E:  Ad=03(O) Atr=01(Isoc) MxPS=   0 Ivl=1ms
I:  If#= 1 Alt= 1 #EPs= 2 Cls=ff(vend.) Sub=01 Prot=01 Driver=btusb
E:  Ad=83(I) Atr=01(Isoc) MxPS=   9 Ivl=1ms
E:  Ad=03(O) Atr=01(Isoc) MxPS=   9 Ivl=1ms
I:  If#= 1 Alt= 2 #EPs= 2 Cls=ff(vend.) Sub=01 Prot=01 Driver=btusb
E:  Ad=83(I) Atr=01(Isoc) MxPS=  17 Ivl=1ms
E:  Ad=03(O) Atr=01(Isoc) MxPS=  17 Ivl=1ms
I:  If#= 1 Alt= 3 #EPs= 2 Cls=ff(vend.) Sub=01 Prot=01 Driver=btusb
E:  Ad=83(I) Atr=01(Isoc) MxPS=  25 Ivl=1ms
E:  Ad=03(O) Atr=01(Isoc) MxPS=  25 Ivl=1ms
I:  If#= 1 Alt= 4 #EPs= 2 Cls=ff(vend.) Sub=01 Prot=01 Driver=btusb
E:  Ad=83(I) Atr=01(Isoc) MxPS=  33 Ivl=1ms
E:  Ad=03(O) Atr=01(Isoc) MxPS=  33 Ivl=1ms
I:  If#= 1 Alt= 5 #EPs= 2 Cls=ff(vend.) Sub=01 Prot=01 Driver=btusb
E:  Ad=83(I) Atr=01(Isoc) MxPS=  49 Ivl=1ms
E:  Ad=03(O) Atr=01(Isoc) MxPS=  49 Ivl=1ms
I:* If#= 2 Alt= 0 #EPs= 2 Cls=ff(vend.) Sub=ff Prot=ff Driver=(none)
E:  Ad=84(I) Atr=02(Bulk) MxPS=  32 Ivl=0ms
E:  Ad=04(O) Atr=02(Bulk) MxPS=  32 Ivl=0ms
I:* If#= 3 Alt= 0 #EPs= 0 Cls=fe(app. ) Sub=01 Prot=01 Driver=(none)

Firmware is extracted from the latest Broadcom BCM4352 Windows driver
by extracting the zip and searching the .hex file names for '17cf'.

The hex file must then be converted to hcd format using the hex2hcd
utility and then moved to /lib/firmware/brcm/.

Signed-off-by: Rick Dunn <rick@rickdunn.com>
Signed-off-by: Marcel Holtmann <marcel@holtmann.org>
Cc: stable@vger.kernel.org

