Bluetooth: btusb: add ID for LiteOn 04ca:301a

Contains a QCA6174A chipset, with USB BT. Let's support loading
firmware on it.

From usb-devices:
T:  Bus=02 Lev=01 Prnt=01 Port=00 Cnt=01 Dev#=  2 Spd=12   MxCh= 0
D:  Ver= 2.01 Cls=e0(wlcon) Sub=01 Prot=01 MxPS=64 #Cfgs=  1
P:  Vendor=04ca ProdID=301a Rev= 0.01
C:* #Ifs= 2 Cfg#= 1 Atr=e0 MxPwr=100mA
I:* If#= 0 Alt= 0 #EPs= 3 Cls=e0(wlcon) Sub=01 Prot=01 Driver=btusb
I:* If#= 1 Alt= 0 #EPs= 2 Cls=e0(wlcon) Sub=01 Prot=01 Driver=btusb

Signed-off-by: Vic Wei <vwei@codeaurora.org>
Signed-off-by: Matthias Kaehlcke <mka@chromium.org>
Signed-off-by: Marcel Holtmann <marcel@holtmann.org>

