Bluetooth: add support for atheros 0930:0219

Add support for the AR3012 chip found on the Toshiba Sallite M840-1000-XQ.

usb-devices shows:

T:  Bus=01 Lev=02 Prnt=02 Port=02 Cnt=01 Dev#=  5 Spd=12  MxCh= 0
D:  Ver= 1.10 Cls=e0(wlcon) Sub=01 Prot=01 MxPS=64 #Cfgs=  1
P:  Vendor=0930 ProdID=0219 Rev=00.02
S:  Manufacturer=Atheros Communications
S:  Product=Bluetooth USB Host Controller
S:  SerialNumber=Alaska Day 2006
C:  #Ifs= 2 Cfg#= 1 Atr=e0 MxPwr=100mA
I:  If#= 0 Alt= 0 #EPs= 3 Cls=e0(wlcon) Sub=01 Prot=01 Driver=btusb
I:  If#= 1 Alt= 0 #EPs= 2 Cls=e0(wlcon) Sub=01 Prot=01 Driver=btusb

Signed-off-by: Giancarlo Formicuccia <giancarlo.formicuccia@gmail.com>
Signed-off-by: Gustavo Padovan <gustavo.padovan@collabora.co.uk>

