Bluetooth: Support AR3011 in Acer Iconia Tab W500

Acer used this chip connected via USB:

Bus 005 Device 005: ID 0cf3:3005 Atheros Communications, Inc. AR3011 Bluetooth
Device Descriptor:
  bLength                18
  bDescriptorType         1
  bcdUSB               1.10
  bDeviceClass          224 Wireless
  bDeviceSubClass         1 Radio Frequency
  bDeviceProtocol         1 Bluetooth
  bMaxPacketSize0        64
  idVendor           0x0cf3 Atheros Communications, Inc.
  idProduct          0x3005 AR3011 Bluetooth
  bcdDevice            0.01
  iManufacturer           0
  iProduct                0
  iSerial                 0
  bNumConfigurations      1

Signed-off-by: Marek Vasut <marex@denx.de>
Cc: Gustavo Padovan <gustavo@padovan.org>
Cc: Johan Hedberg <johan.hedberg@gmail.com>
Cc: Marcel Holtmann <marcel@holtmann.org>
Signed-off-by: Gustavo Padovan <gustavo.padovan@collabora.co.uk>

