Bluetooth: Add support for Foxconn/Hon Hai AR5BBU22 0489:E03C

Add Foxconn/Hon Hai AR5BBU22 Bluetooth Module( 0x489:0xE03C) to
the blacklist of btusb module and add it to the ath3k module to properly
load the firmware in Kernel 3.3.4
The device is integrated in  e.g. some  Acer Aspire 7750G.

Output from /sys/kernel/debug/usb/devices:

T:  Bus=01 Lev=02 Prnt=02 Port=05 Cnt=02 Dev#=  6 Spd=12   MxCh= 0
D:  Ver= 2.00 Cls=e0(wlcon) Sub=01 Prot=01 MxPS=64 #Cfgs=  1
P:  Vendor=0489 ProdID=e03c Rev= 0.02
S:  Manufacturer=Atheros Communications
S:  Product=Bluetooth USB Host Controller
S:  SerialNumber=Alaska Day 2006
C:* #Ifs= 2 Cfg#= 1 Atr=e0 MxPwr=100mA
I:* If#= 0 Alt= 0 #EPs= 3 Cls=e0(wlcon) Sub=01 Prot=01 Driver=btusb
E:  Ad=81(I) Atr=03(Int.) MxPS=  16 Ivl=1ms
E:  Ad=82(I) Atr=02(Bulk) MxPS=  64 Ivl=0ms
E:  Ad=02(O) Atr=02(Bulk) MxPS=  64 Ivl=0ms
I:* If#= 1 Alt= 0 #EPs= 2 Cls=e0(wlcon) Sub=01 Prot=01 Driver=btusb
E:  Ad=83(I) Atr=01(Isoc) MxPS=   0 Ivl=1ms
E:  Ad=03(O) Atr=01(Isoc) MxPS=   0 Ivl=1ms
I:  If#= 1 Alt= 1 #EPs= 2 Cls=e0(wlcon) Sub=01 Prot=01 Driver=btusb
E:  Ad=83(I) Atr=01(Isoc) MxPS=   9 Ivl=1ms
E:  Ad=03(O) Atr=01(Isoc) MxPS=   9 Ivl=1ms
I:  If#= 1 Alt= 2 #EPs= 2 Cls=e0(wlcon) Sub=01 Prot=01 Driver=btusb
E:  Ad=83(I) Atr=01(Isoc) MxPS=  17 Ivl=1ms
E:  Ad=03(O) Atr=01(Isoc) MxPS=  17 Ivl=1ms
I:  If#= 1 Alt= 3 #EPs= 2 Cls=e0(wlcon) Sub=01 Prot=01 Driver=btusb
E:  Ad=83(I) Atr=01(Isoc) MxPS=  25 Ivl=1ms
E:  Ad=03(O) Atr=01(Isoc) MxPS=  25 Ivl=1ms
I:  If#= 1 Alt= 4 #EPs= 2 Cls=e0(wlcon) Sub=01 Prot=01 Driver=btusb
E:  Ad=83(I) Atr=01(Isoc) MxPS=  33 Ivl=1ms
E:  Ad=03(O) Atr=01(Isoc) MxPS=  33 Ivl=1ms
I:  If#= 1 Alt= 5 #EPs= 2 Cls=e0(wlcon) Sub=01 Prot=01 Driver=btusb
E:  Ad=83(I) Atr=01(Isoc) MxPS=  49 Ivl=1ms
E:  Ad=03(O) Atr=01(Isoc) MxPS=  49 Ivl=1ms

Signed-off-by: Michael Gruetzner <mgruetzn@gmx.de>
Signed-off-by: Gustavo Padovan <gustavo@padovan.org>

