Bluetooth: Add support for Broadcom BCM20702A1 variant

This variant requires the flag BTUSB_BCM_PATCHRAM to work.

Relevant details from /sys/kernel/debug/usb/devices:

T:  Bus=01 Lev=02 Prnt=02 Port=04 Cnt=01 Dev#=  3 Spd=12   MxCh= 0
D:  Ver= 2.00 Cls=ff(vend.) Sub=01 Prot=01 MxPS=64 #Cfgs=  1
P:  Vendor=13d3 ProdID=3404 Rev= 1.12
S:  Manufacturer=Broadcom Corp
S:  Product=BCM20702A0
S:  SerialNumber=240A646F1XXX
C:* #Ifs= 4 Cfg#= 1 Atr=e0 MxPwr=  0mA
I:* If#= 0 Alt= 0 #EPs= 3 Cls=ff(vend.) Sub=01 Prot=01 Driver=btusb
E:  Ad=81(I) Atr=03(Int.) MxPS=  16 Ivl=1ms
E:  Ad=82(I) Atr=02(Bulk) MxPS=  64 Ivl=0ms
E:  Ad=02(O) Atr=02(Bulk) MxPS=  64 Ivl=0ms
I:* If#= 1 Alt= 0 #EPs= 2 Cls=ff(vend.) Sub=01 Prot=01 Driver=btusb
E:  Ad=83(I) Atr=01(Isoc) MxPS=   0 Ivl=1ms
E:  Ad=03(O) Atr=01(Isoc) MxPS=   0 Ivl=1ms
I:  If#= 1 Alt= 1 #EPs= 2 Cls=ff(vend.) Sub=01 Prot=01 Driver=btusb
E:  Ad=83(I) Atr=01(Isoc) MxPS=   9 Ivl=1ms
E:  Ad=03(O) Atr=01(Isoc) MxPS=   9 Ivl=1ms
I:  If#= 1 Alt= 2 #EPs= 2 Cls=ff(vend.) Sub=01 Prot=01 Driver=btusb
E:  Ad=83(I) Atr=01(Isoc) MxPS=  17 Ivl=1ms
E:  Ad=03(O) Atr=01(Isoc) MxPS=  17 Ivl=1ms
I:  If#= 1 Alt= 3 #EPs= 2 Cls=ff(vend.) Sub=01 Prot=01 Driver=btusb
E:  Ad=83(I) Atr=01(Isoc) MxPS=  25 Ivl=1ms
E:  Ad=03(O) Atr=01(Isoc) MxPS=  25 Ivl=1ms
I:  If#= 1 Alt= 4 #EPs= 2 Cls=ff(vend.) Sub=01 Prot=01 Driver=btusb
E:  Ad=83(I) Atr=01(Isoc) MxPS=  33 Ivl=1ms
E:  Ad=03(O) Atr=01(Isoc) MxPS=  33 Ivl=1ms
I:  If#= 1 Alt= 5 #EPs= 2 Cls=ff(vend.) Sub=01 Prot=01 Driver=btusb
E:  Ad=83(I) Atr=01(Isoc) MxPS=  49 Ivl=1ms
E:  Ad=03(O) Atr=01(Isoc) MxPS=  49 Ivl=1ms
I:* If#= 2 Alt= 0 #EPs= 2 Cls=ff(vend.) Sub=ff Prot=ff Driver=(none)
E:  Ad=84(I) Atr=02(Bulk) MxPS=  32 Ivl=0ms
E:  Ad=04(O) Atr=02(Bulk) MxPS=  32 Ivl=0ms
I:* If#= 3 Alt= 0 #EPs= 0 Cls=fe(app. ) Sub=01 Prot=01 Driver=(none)

The firmware was extracted from a Windows 8.1 64-bit installation
and converted from 'hex' to 'hcd' for use in Linux.

Under Windows it also identifies itself as BCM20702A0,
but the firmware is named "BCM20702A1_001.002.014.1315.1356.hex"
and is located in "%SYSTEMROOT%\system32\drivers\"
(md5 67cf6bfdae61c4bb819a66da984f7913)
(sha1 5f74cc6a9a3bf19ee0f8c3d01e4be34c609b188f)

The same firmware file is also available as a download at
http://www.asrock.com/mb/Intel/Z87E-ITX/?cat=Download&os=All
marked as "Bluetooth driver ver:12.0.0.7820"

'hcd' file should be placed at "brcm/BCM20702A0-13d3-3404.hcd"
inside the firmware directory (e.g. "/lib/firmware")

Signed-off-by: Fabio K <healthkit@gmail.com>
Signed-off-by: Marcel Holtmann <marcel@holtmann.org>

