Bluetooth: btusb: Add support for 13d3:3548 Realtek 8822CE device

The ASUS FX505DV laptop contains RTL8822CE device with an
associated BT chip using a USB ID of 13d3:3548.
This patch add fw download support for it.

T:  Bus=03 Lev=01 Prnt=01 Port=03 Cnt=03 Dev#=  4 Spd=12   MxCh= 0
D:  Ver= 1.00 Cls=e0(wlcon) Sub=01 Prot=01 MxPS=64 #Cfgs=  1
P:  Vendor=13d3 ProdID=3548 Rev= 0.00
S:  Manufacturer=Realtek
S:  Product=Bluetooth Radio
S:  SerialNumber=00e04c000001
C:* #Ifs= 2 Cfg#= 1 Atr=a0 MxPwr=500mA
I:* If#= 0 Alt= 0 #EPs= 3 Cls=e0(wlcon) Sub=01 Prot=01 Driver=btusb
E:  Ad=81(I) Atr=03(Int.) MxPS=  16 Ivl=1ms
E:  Ad=02(O) Atr=02(Bulk) MxPS=  64 Ivl=0ms
E:  Ad=82(I) Atr=02(Bulk) MxPS=  64 Ivl=0ms
I:* If#= 1 Alt= 0 #EPs= 2 Cls=e0(wlcon) Sub=01 Prot=01 Driver=btusb
E:  Ad=03(O) Atr=01(Isoc) MxPS=   0 Ivl=1ms
E:  Ad=83(I) Atr=01(Isoc) MxPS=   0 Ivl=1ms
I:  If#= 1 Alt= 1 #EPs= 2 Cls=e0(wlcon) Sub=01 Prot=01 Driver=btusb
E:  Ad=03(O) Atr=01(Isoc) MxPS=   9 Ivl=1ms
E:  Ad=83(I) Atr=01(Isoc) MxPS=   9 Ivl=1ms
I:  If#= 1 Alt= 2 #EPs= 2 Cls=e0(wlcon) Sub=01 Prot=01 Driver=btusb
E:  Ad=03(O) Atr=01(Isoc) MxPS=  17 Ivl=1ms
E:  Ad=83(I) Atr=01(Isoc) MxPS=  17 Ivl=1ms
I:  If#= 1 Alt= 3 #EPs= 2 Cls=e0(wlcon) Sub=01 Prot=01 Driver=btusb
E:  Ad=03(O) Atr=01(Isoc) MxPS=  25 Ivl=1ms
E:  Ad=83(I) Atr=01(Isoc) MxPS=  25 Ivl=1ms
I:  If#= 1 Alt= 4 #EPs= 2 Cls=e0(wlcon) Sub=01 Prot=01 Driver=btusb
E:  Ad=03(O) Atr=01(Isoc) MxPS=  33 Ivl=1ms
E:  Ad=83(I) Atr=01(Isoc) MxPS=  33 Ivl=1ms
I:  If#= 1 Alt= 5 #EPs= 2 Cls=e0(wlcon) Sub=01 Prot=01 Driver=btusb
E:  Ad=03(O) Atr=01(Isoc) MxPS=  49 Ivl=1ms
E:  Ad=83(I) Atr=01(Isoc) MxPS=  49 Ivl=1ms

Signed-off-by: Sergey Shatunov <me@prok.pw>
Signed-off-by: Marcel Holtmann <marcel@holtmann.org>

