Bluetooth: Add a new PID/VID 0cf3/e005 for AR3012.

usb device info:

T:  Bus=06 Lev=01 Prnt=01 Port=01 Cnt=01 Dev#= 15 Spd=12   MxCh= 0
D:  Ver= 1.10 Cls=e0(wlcon) Sub=01 Prot=01 MxPS=64 #Cfgs=  1
P:  Vendor=0cf3 ProdID=e005 Rev= 0.02
C:* #Ifs= 2 Cfg#= 1 Atr=e0 MxPwr=100mA
I:* If#= 0 Alt= 0 #EPs= 3 Cls=e0(wlcon) Sub=01 Prot=01 Driver=btusb
E:  Ad=81(I) Atr=03(Int.) MxPS=  16 Ivl=1ms
E:  Ad=82(I) Atr=02(Bulk) MxPS=  64 Ivl=0ms
E:  Ad=02(O) Atr=02(Bulk) MxPS=  64 Ivl=0ms
I:* If#= 1 Alt= 0 #EPs= 2 Cls=e0(wlcon) Sub=01 Prot=01 Driver=btusb
E:  Ad=83(I) Atr=01(Isoc) MxPS=   0 Ivl=1ms
E:  Ad=03(O) Atr=01(Isoc) MxPS=   0 Ivl=1ms

Cc: Stable <stable@vger.kernel.org>
Signed-off-by: Peng Chen <pengchen@qca.qualcomm.com>
Signed-off-by: Gustavo Padovan <gustavo.padovan@collabora.co.uk>

