Bluetooth: Add support for BCM20702A0 [0b05, 17cb]

Yet another vendor specific ID for this chipset; this one for the ASUS
USB-BT400 Bluetooth 4.0 adapter.

T:  Bus=03 Lev=02 Prnt=02 Port=01 Cnt=01 Dev#=  6 Spd=12  MxCh= 0
D:  Ver= 2.00 Cls=ff(vend.) Sub=01 Prot=01 MxPS=64 #Cfgs=  1
P:  Vendor=0b05 ProdID=17cb Rev=01.12
S:  Manufacturer=Broadcom Corp
S:  Product=BCM20702A0
S:  SerialNumber=000272C64400
C:  #Ifs= 4 Cfg#= 1 Atr=a0 MxPwr=100mA
I:  If#= 0 Alt= 0 #EPs= 3 Cls=ff(vend.) Sub=01 Prot=01 Driver=(none)
I:  If#= 1 Alt= 0 #EPs= 2 Cls=ff(vend.) Sub=01 Prot=01 Driver=(none)
I:  If#= 2 Alt= 0 #EPs= 2 Cls=ff(vend.) Sub=ff Prot=ff Driver=(none)
I:  If#= 3 Alt= 0 #EPs= 0 Cls=fe(app. ) Sub=01 Prot=01 Driver=(none)

Cc: stable@vger.kernel.org
Signed-off-by: Raphael Kubo da Costa <rakuco@FreeBSD.org>
Signed-off-by: Gustavo Padovan <gustavo.padovan@collabora.co.uk>

