Bluetooth: Add support for Atheros [13d3:3362]

Add another vendor specific ID for Atheros AR3012 device.
This chip is wrapped by IMC Networks.

output of usb-devices:
T:  Bus=01 Lev=02 Prnt=02 Port=00 Cnt=01 Dev#=  5 Spd=12  MxCh= 0
D:  Ver= 1.10 Cls=e0(wlcon) Sub=01 Prot=01 MxPS=64 #Cfgs=  1
P:  Vendor=13d3 ProdID=3362 Rev=00.02
S:  Manufacturer=Atheros Communications
S:  Product=Bluetooth USB Host Controller
S:  SerialNumber=Alaska Day 2006
C:  #Ifs= 2 Cfg#= 1 Atr=e0 MxPwr=100mA
I:  If#= 0 Alt= 0 #EPs= 3 Cls=e0(wlcon) Sub=01 Prot=01 Driver=btusb
I:  If#= 1 Alt= 0 #EPs= 2 Cls=e0(wlcon) Sub=01 Prot=01 Driver=btusb

Signed-off-by: AceLan Kao <acelan.kao@canonical.com>
Signed-off-by: Johan Hedberg <johan.hedberg@intel.com>

